{
  "project": { "name": "test-project", "preset": "standard" },
  "harnesses": {
    "cascadeUpdate": true,
    "agentLessonCollection": true,
    "bundleSizeLimit": 500,
    "deadCodeGC": false
  },
  "quickMode": {
    "relaxedGates": ["phase-gate", "2-phase-execution"]
  },
  "layers": {},
  "phaseDependencies": { "preset": "default", "override": false, "customRules": [] },
  "planningMode": { "default": "interactive", "perPhase": {} },
  "paths": { "designDocs": "docs", "inceptionDocs": "docs/inception" },
  "reporting": { "format": "json", "outputDir": "reports" }
}
