{
  "project": {
    "name": "phasegate",
    "preset": "standard"
  },
  "layers": {
    "L0": {
      "enabled": false
    },
    "L1": {
      "enabled": true
    },
    "L2": {
      "enabled": true
    },
    "L3": {
      "enabled": true
    },
    "L4": {
      "enabled": false
    }
  },
  "quickMode": {
    "allowedCategories": [
      "bugfix",
      "docs",
      "test",
      "config"
    ],
    "maintainedLayers": [
      "L1",
      "L2"
    ],
    "relaxedGates": [
      "phase-gate",
      "2-phase-execution"
    ]
  },
  "phaseDependencies": {
    "preset": "default",
    "override": false,
    "customRules": []
  },
  "planningMode": {
    "default": "interactive",
    "perPhase": {}
  },
  "harnesses": {
    "agentLessonCollection": false,
    "cascadeUpdate": false,
    "bundleSizeLimit": 0,
    "deadCodeGC": false
  },
  "paths": {
    "designDocs": "docs/product/construction",
    "inceptionDocs": "docs/inception"
  },
  "reporting": {
    "format": "json",
    "outputDir": "reports"
  },
  "protectedFiles": {
    "exclude": [
      "tsconfig.json",
      "package.json"
    ]
  }
}
